<?xml version="1.0" encoding="UTF-8"?>
<!--Sample XML file generated by XMLSpy v2008 sp1 (http://www.altova.com)-->
<salus:roott attr1="attr1val" attr2="2" attr3="MSK" attr4="4" attr5="attr5val" xmlns:salus="http://www.salusproject.eu/ontology/test" xmlns:xsi="http://www.w3.org/2001/XMLSchema-instance" xsi:schemaLocation="http://www.salusproject.eu/ontology/test test.xsd">
	<salus:elem1>elem1val</salus:elem1>
	<salus:elem2>22</salus:elem2>
	<salus:elem3>NP</salus:elem3>
	<salus:elem4>elem4val</salus:elem4>
	<salus:elem5>elem5val</salus:elem5>
	<salus:elem6 ctattr1="ctattr1val" ctattr2="NP">
		<salus:ctelem1>ctelem1val</salus:ctelem1>
		<salus:ctelem2>ctelem2val</salus:ctelem2>
		<salus:ctelem3>ctelem3val</salus:ctelem3>
		<salus:ctelem4 mixedattr1="mixedattr1val" mixedattr2="NI">ctelem4val</salus:ctelem4>
		<salus:elemSimpleAndComplex>NP</salus:elemSimpleAndComplex>
	</salus:elem6>
	<salus:elemSimpleAndComplex>
		<salus:cmp3elem1>3.14</salus:cmp3elem1>
	</salus:elemSimpleAndComplex>
</salus:roott>
